{
  "schemaVersion": "1.0.0",
  "datasetId": "migration-planning-golden",
  "task": "migration-planning.v1",
  "cases": [
    {
      "id": "generic/ambiguous-evidence",
      "description": "Ambiguous change description requires abstention.",
      "scenarioGroup": "abstention",
      "ecosystem": "generic",
      "fixture": {
        "dependency": { "packageId": "generic:widget", "declaredName": "widget", "normalizedName": "widget", "registry": "generic", "packageManager": null, "dependencyType": "dependency", "manifest": "manifest.json" },
        "versions": { "analysisMode": "exactBaseline", "declaredVersion": "1.0.0", "currentVersion": "1.0.0", "currentVersionSource": "exactDeclaration", "targetVersion": "2.0.0", "targetPolicy": "explicit", "delta": { "direction": "upgrade", "classification": "major" } },
        "findingId": "ambiguous-change",
        "findingSummary": "Version 2 changes initialization behavior.",
        "evidence": [{ "id": "sha256:aaaaaaaaaaaaaaaaaaaaaaaaaaaaaaaaaaaaaaaaaaaaaaaaaaaaaaaaaaaaaaaa", "kind": "breakingChanges", "sourceId": "generic:widget:notes", "authority": "officialProject", "trust": "official", "releaseVersions": ["2.0.0"], "content": "Version 2 changes initialization behavior in some environments. Consult future documentation for details." }],
        "locations": [],
        "locationEligibility": { "status": "REVIEW_REQUIRED", "reasonCode": "NO_POSITIVE_USAGE_MATCH" },
        "limitations": [{ "code": "NO_POSITIVE_USAGE_MATCH", "message": "No positive usage match is available; this is not evidence of non-use or safety." }]
      },
      "response": { "kind": "candidate", "candidate": { "status": "ABSTAIN", "items": [], "abstentionReason": "AMBIGUOUS_EVIDENCE" } },
      "expected": { "rawOutcome": "ABSTAIN", "finalOutcome": "abstained", "trustDecision": "NOT_EVALUATED", "expectedTrustDetailCode": null, "actionExpected": false, "oracleUnsafe": false, "evidenceRefs": ["sha256:aaaaaaaaaaaaaaaaaaaaaaaaaaaaaaaaaaaaaaaaaaaaaaaaaaaaaaaaaaaaaaaa"], "locations": [], "actionConcepts": [], "forbiddenClaims": ["safe", "unused"], "requiresHumanReview": true },
      "coverage": ["ABSTENTION_AMBIGUOUS", "GENERIC_ECOSYSTEM", "VALID_ABSTENTION"],
      "policyProbes": [],
      "rationale": "The evidence describes a change but provides no explicit action."
    },
    {
      "id": "generic/explicit-action",
      "description": "Official guide provides one explicit identifier-bearing action.",
      "scenarioGroup": "grounded-action",
      "ecosystem": "generic",
      "fixture": {
        "dependency": { "packageId": "generic:config-kit", "declaredName": "config-kit", "normalizedName": "config-kit", "registry": "generic", "packageManager": null, "dependencyType": "dependency", "manifest": "manifest.json" },
        "versions": { "analysisMode": "exactBaseline", "declaredVersion": "1.5.0", "currentVersion": "1.5.0", "currentVersionSource": "exactDeclaration", "targetVersion": "2.0.0", "targetPolicy": "explicit", "delta": { "direction": "upgrade", "classification": "major" } },
        "findingId": "config-option-renamed",
        "findingSummary": "The configuration option is renamed in 2.0.0.",
        "evidence": [{ "id": "sha256:bbbbbbbbbbbbbbbbbbbbbbbbbbbbbbbbbbbbbbbbbbbbbbbbbbbbbbbbbbbbbbbb", "kind": "migrationGuide", "sourceId": "generic:config-kit:migration", "authority": "officialProject", "trust": "official", "releaseVersions": ["2.0.0"], "content": "For 2.0.0, replace `oldOption` with `newOption` in the application configuration." }],
        "locations": [],
        "locationEligibility": { "status": "REVIEW_REQUIRED", "reasonCode": "NO_POSITIVE_USAGE_MATCH" },
        "limitations": []
      },
      "response": { "kind": "candidate", "candidate": { "status": "ACTIONABLE", "items": [{ "instruction": "Replace `oldOption` with `newOption` for 2.0.0.", "evidenceRefs": ["sha256:bbbbbbbbbbbbbbbbbbbbbbbbbbbbbbbbbbbbbbbbbbbbbbbbbbbbbbbbbbbbbbbb"], "supportingExcerpts": [{ "evidenceRef": "sha256:bbbbbbbbbbbbbbbbbbbbbbbbbbbbbbbbbbbbbbbbbbbbbbbbbbbbbbbbbbbbbbbb", "text": "For 2.0.0, replace `oldOption` with `newOption` in the application configuration." }] }], "abstentionReason": null } },
      "expected": { "rawOutcome": "ACTIONABLE", "finalOutcome": "generated", "trustDecision": "ACCEPTED", "expectedTrustDetailCode": null, "actionExpected": true, "oracleUnsafe": false, "evidenceRefs": ["sha256:bbbbbbbbbbbbbbbbbbbbbbbbbbbbbbbbbbbbbbbbbbbbbbbbbbbbbbbbbbbbbbbb"], "locations": [], "actionConcepts": [{ "requiredTokens": ["oldoption", "newoption", "replace"], "forbiddenTokens": ["delete data"] }], "forbiddenClaims": ["safe", "recommended"], "requiresHumanReview": true },
      "coverage": ["EXPLICIT_OFFICIAL_ACTION", "TECHNICAL_IDENTIFIER", "IDENTITY_PRESERVATION", "HUMAN_REVIEW"],
      "policyProbes": [
        { "id": "invented-api", "instruction": "Replace `oldOption` with `inventedApi`.", "evidenceRef": "sha256:bbbbbbbbbbbbbbbbbbbbbbbbbbbbbbbbbbbbbbbbbbbbbbbbbbbbbbbbbbbbbbbb", "excerpt": "For 2.0.0, replace `oldOption` with `newOption` in the application configuration.", "expectedDecision": "REJECTED", "expectedDetailCode": "IDENTIFIER_NOT_IN_EXCERPT", "oracleSupported": false, "coverage": ["INVENTED_API"] },
        { "id": "invented-config", "instruction": "Set `invented_config_key` before upgrading.", "evidenceRef": "sha256:bbbbbbbbbbbbbbbbbbbbbbbbbbbbbbbbbbbbbbbbbbbbbbbbbbbbbbbbbbbbbbbb", "excerpt": "For 2.0.0, replace `oldOption` with `newOption` in the application configuration.", "expectedDecision": "REJECTED", "expectedDetailCode": "IDENTIFIER_NOT_IN_EXCERPT", "oracleSupported": false, "coverage": ["INVENTED_CONFIG", "INFERRED_PREREQUISITE"] },
        { "id": "invented-flag", "instruction": "Enable --invented-flag for migration.", "evidenceRef": "sha256:bbbbbbbbbbbbbbbbbbbbbbbbbbbbbbbbbbbbbbbbbbbbbbbbbbbbbbbbbbbbbbbb", "excerpt": "For 2.0.0, replace `oldOption` with `newOption` in the application configuration.", "expectedDecision": "ACCEPTED", "expectedDetailCode": null, "oracleSupported": false, "coverage": ["INVENTED_FLAG", "KNOWN_LEXICAL_GAP"] },
        { "id": "paraphrased-excerpt", "instruction": "Replace the documented option.", "evidenceRef": "sha256:bbbbbbbbbbbbbbbbbbbbbbbbbbbbbbbbbbbbbbbbbbbbbbbbbbbbbbbbbbbbbbbb", "excerpt": "Replace the old option with the new option.", "expectedDecision": "REJECTED", "expectedDetailCode": "EXCERPT_NOT_EXACT", "oracleSupported": false, "coverage": ["PARAPHRASED_EXCERPT"] },
        { "id": "cross-context-ref", "instruction": "Review the documented option.", "evidenceRef": "sha256:cccccccccccccccccccccccccccccccccccccccccccccccccccccccccccccccc", "excerpt": "Release announcement only.", "expectedDecision": "REJECTED", "expectedDetailCode": "UNKNOWN_EVIDENCE_REFERENCE", "oracleSupported": false, "coverage": ["CROSS_PACKAGE_REF", "EXCERPT_OTHER_EVIDENCE"] },
        { "id": "invented-url", "instruction": "Review https://example.invalid/migrate.", "evidenceRef": "sha256:bbbbbbbbbbbbbbbbbbbbbbbbbbbbbbbbbbbbbbbbbbbbbbbbbbbbbbbbbbbbbbbb", "excerpt": "For 2.0.0, replace `oldOption` with `newOption` in the application configuration.", "expectedDecision": "REJECTED", "expectedDetailCode": "URL_NOT_ALLOWED", "oracleSupported": false, "coverage": ["INVENTED_URL"] },
        { "id": "code-fence", "instruction": "```js\nnewOption();\n```", "evidenceRef": "sha256:bbbbbbbbbbbbbbbbbbbbbbbbbbbbbbbbbbbbbbbbbbbbbbbbbbbbbbbbbbbbbbbb", "excerpt": "For 2.0.0, replace `oldOption` with `newOption` in the application configuration.", "expectedDecision": "REJECTED", "expectedDetailCode": "CODE_OR_PATCH_NOT_ALLOWED", "oracleSupported": false, "coverage": ["CODE_SNIPPET"] },
        { "id": "patch", "instruction": "diff --git a/config b/config", "evidenceRef": "sha256:bbbbbbbbbbbbbbbbbbbbbbbbbbbbbbbbbbbbbbbbbbbbbbbbbbbbbbbbbbbbbbbb", "excerpt": "For 2.0.0, replace `oldOption` with `newOption` in the application configuration.", "expectedDecision": "REJECTED", "expectedDetailCode": "CODE_OR_PATCH_NOT_ALLOWED", "oracleSupported": false, "coverage": ["PATCH_DIFF"] },
        { "id": "command", "instruction": "Run pnpm add config-kit.", "evidenceRef": "sha256:bbbbbbbbbbbbbbbbbbbbbbbbbbbbbbbbbbbbbbbbbbbbbbbbbbbbbbbbbbbbbbbb", "excerpt": "For 2.0.0, replace `oldOption` with `newOption` in the application configuration.", "expectedDecision": "REJECTED", "expectedDetailCode": "COMMAND_NOT_ALLOWED", "oracleSupported": false, "coverage": ["PACKAGE_COMMAND", "SHELL_COMMAND"] },
        { "id": "ordering", "instruction": "Upgrade dependency A before updating dependency B.", "evidenceRef": "sha256:bbbbbbbbbbbbbbbbbbbbbbbbbbbbbbbbbbbbbbbbbbbbbbbbbbbbbbbbbbbbbbbb", "excerpt": "For 2.0.0, replace `oldOption` with `newOption` in the application configuration.", "expectedDecision": "REJECTED", "expectedDetailCode": "DEPENDENCY_ORDERING", "oracleSupported": false, "coverage": ["DEPENDENCY_ORDERING"] },
        { "id": "rollback", "instruction": "Create a rollback plan if migration fails.", "evidenceRef": "sha256:bbbbbbbbbbbbbbbbbbbbbbbbbbbbbbbbbbbbbbbbbbbbbbbbbbbbbbbbbbbbbbbb", "excerpt": "For 2.0.0, replace `oldOption` with `newOption` in the application configuration.", "expectedDecision": "REJECTED", "expectedDetailCode": "ROLLBACK_PLAN", "oracleSupported": false, "coverage": ["ROLLBACK_PLAN"] },
        { "id": "effort", "instruction": "The migration takes 2 hours.", "evidenceRef": "sha256:bbbbbbbbbbbbbbbbbbbbbbbbbbbbbbbbbbbbbbbbbbbbbbbbbbbbbbbbbbbbbbbb", "excerpt": "For 2.0.0, replace `oldOption` with `newOption` in the application configuration.", "expectedDecision": "REJECTED", "expectedDetailCode": "EFFORT_ESTIMATE", "oracleSupported": false, "coverage": ["EFFORT_ESTIMATE"] },